{
  "generated_from": "scripts/gen_navmap.py",
  "index": {
    "by_issue": {
      "#72": [
        "lgwks_admission",
        "lgwks_capability"
      ],
      "#73": [
        "lgwks_crdt"
      ],
      "#74": [
        "lgwks_viz_project"
      ],
      "#75": [
        "lgwks_waste"
      ]
    },
    "by_packet": {
      "I1": [
        "lgwks_vector"
      ],
      "I10": [
        "lgwks_viz_project"
      ],
      "I11": [
        "lgwks_waste"
      ],
      "I2": [
        "lgwks_input"
      ],
      "I3": [
        "lgwks_lfm2_extract"
      ],
      "I4": [
        "lgwks_embed_port"
      ],
      "I5": [
        "lgwks_score"
      ],
      "I6": [
        "lgwks_rank"
      ],
      "I7": [
        "lgwks_inbound"
      ],
      "I8": [
        "lgwks_admission",
        "lgwks_capability"
      ],
      "I9": [
        "lgwks_crdt"
      ]
    },
    "by_staleness": {
      "active": [
        "axiom.__init__",
        "axiom.capsule",
        "axiom.cid",
        "axiom.fabric",
        "axiom.varint",
        "axiom.verify",
        "axiom.wire",
        "graphify.__init__",
        "graphify.cluster",
        "hooks.subconscious_inbound",
        "lgwks_access",
        "lgwks_admission",
        "lgwks_admission_store",
        "lgwks_agent_os",
        "lgwks_apple",
        "lgwks_aup",
        "lgwks_auth_runtime",
        "lgwks_axiom",
        "lgwks_batch",
        "lgwks_bot_code_hacker",
        "lgwks_bot_optimizer",
        "lgwks_bot_slop_math",
        "lgwks_bot_stress",
        "lgwks_browser",
        "lgwks_cache",
        "lgwks_capabilities",
        "lgwks_capability",
        "lgwks_capture",
        "lgwks_codebase",
        "lgwks_cognition",
        "lgwks_cohere",
        "lgwks_comprehend",
        "lgwks_concept",
        "lgwks_context",
        "lgwks_coreml",
        "lgwks_crawl",
        "lgwks_crdt",
        "lgwks_cycle",
        "lgwks_daemon_event",
        "lgwks_debug",
        "lgwks_do",
        "lgwks_embed",
        "lgwks_embed_port",
        "lgwks_engine",
        "lgwks_entity_graph",
        "lgwks_expression",
        "lgwks_extract",
        "lgwks_files",
        "lgwks_foundation",
        "lgwks_gate_arch",
        "lgwks_gate_framework",
        "lgwks_gate_idiom",
        "lgwks_geoexpr",
        "lgwks_gh",
        "lgwks_graph",
        "lgwks_graph_viz",
        "lgwks_ground",
        "lgwks_home",
        "lgwks_hooks",
        "lgwks_html",
        "lgwks_inbound",
        "lgwks_input",
        "lgwks_intent",
        "lgwks_intent_classifier",
        "lgwks_intent_router",
        "lgwks_jepa",
        "lgwks_keyvault",
        "lgwks_lfm2_extract",
        "lgwks_machine",
        "lgwks_manifest",
        "lgwks_map",
        "lgwks_memory",
        "lgwks_model_hub",
        "lgwks_multimodal",
        "lgwks_multiply",
        "lgwks_ollama",
        "lgwks_openrouter",
        "lgwks_openrouter_embed",
        "lgwks_pipeline",
        "lgwks_portal",
        "lgwks_preview",
        "lgwks_project",
        "lgwks_project_artifacts",
        "lgwks_project_deploy",
        "lgwks_project_plan",
        "lgwks_project_review",
        "lgwks_promote",
        "lgwks_public",
        "lgwks_rank",
        "lgwks_refactor",
        "lgwks_repl",
        "lgwks_repo",
        "lgwks_research",
        "lgwks_review",
        "lgwks_run",
        "lgwks_schema",
        "lgwks_score",
        "lgwks_search",
        "lgwks_session",
        "lgwks_sign",
        "lgwks_site_profile",
        "lgwks_sites",
        "lgwks_solve",
        "lgwks_spawn",
        "lgwks_sqlite",
        "lgwks_steering",
        "lgwks_substrate",
        "lgwks_substrate_config",
        "lgwks_substrate_crawl",
        "lgwks_substrate_db",
        "lgwks_substrate_io",
        "lgwks_substrate_run",
        "lgwks_substrate_text",
        "lgwks_substrate_vector",
        "lgwks_synthesizer",
        "lgwks_tongue",
        "lgwks_ui",
        "lgwks_urlrisk",
        "lgwks_vault",
        "lgwks_vector",
        "lgwks_verify",
        "lgwks_viz_project",
        "lgwks_waste",
        "lgwks_workercap",
        "lgwks_workflows",
        "scripts.build_capability_embeddings",
        "scripts.build_capability_idf",
        "scripts.check_schema_registry",
        "scripts.gen_navmap",
        "scripts.setup_models",
        "tools.train_intent_classifier"
      ],
      "orphan": [
        "lgwks_ingest"
      ],
      "staling": [
        "lgwks_daemon_store"
      ]
    },
    "by_subsystem": {
      "Axiom byte framework": [
        "axiom.__init__",
        "axiom.capsule",
        "axiom.cid",
        "axiom.fabric",
        "axiom.varint",
        "axiom.verify",
        "axiom.wire",
        "lgwks_axiom"
      ],
      "Bots / detection / static analysis": [
        "graphify.cluster",
        "lgwks_bot_code_hacker",
        "lgwks_bot_optimizer",
        "lgwks_bot_slop_math",
        "lgwks_bot_stress",
        "lgwks_cohere",
        "lgwks_debug"
      ],
      "CLI / home / membrane surface": [
        "lgwks_foundation",
        "lgwks_gh",
        "lgwks_home",
        "lgwks_manifest",
        "lgwks_ui"
      ],
      "Dev tooling / scripts": [
        "scripts.gen_navmap",
        "scripts.setup_models"
      ],
      "Governance / gates / refusal / auth": [
        "lgwks_aup",
        "lgwks_comprehend",
        "lgwks_embed",
        "lgwks_gate_arch",
        "lgwks_gate_framework",
        "lgwks_gate_idiom",
        "lgwks_keyvault",
        "lgwks_run",
        "lgwks_sign",
        "lgwks_urlrisk",
        "lgwks_verify",
        "scripts.check_schema_registry"
      ],
      "Graph / AST / code intelligence": [
        "graphify.__init__",
        "lgwks_codebase",
        "lgwks_entity_graph",
        "lgwks_graph",
        "lgwks_graph_viz",
        "lgwks_refactor",
        "lgwks_repo",
        "lgwks_review"
      ],
      "Harness / daemon / orchestration": [
        "hooks.subconscious_inbound",
        "lgwks_agent_os",
        "lgwks_capabilities",
        "lgwks_context",
        "lgwks_cycle",
        "lgwks_daemon_event",
        "lgwks_daemon_store",
        "lgwks_do",
        "lgwks_engine",
        "lgwks_ground",
        "lgwks_hooks",
        "lgwks_map",
        "lgwks_portal",
        "lgwks_project",
        "lgwks_project_deploy",
        "lgwks_project_plan",
        "lgwks_project_review",
        "lgwks_repl",
        "lgwks_session",
        "lgwks_solve",
        "lgwks_spawn",
        "lgwks_substrate_run",
        "lgwks_synthesizer",
        "lgwks_tongue",
        "lgwks_workercap",
        "lgwks_workflows"
      ],
      "Ingestion spine (I1\u2013I12)": [
        "lgwks_admission",
        "lgwks_admission_store",
        "lgwks_capability",
        "lgwks_crdt",
        "lgwks_embed_port",
        "lgwks_extract",
        "lgwks_inbound",
        "lgwks_input",
        "lgwks_pipeline",
        "lgwks_promote",
        "lgwks_rank",
        "lgwks_score",
        "lgwks_vector",
        "lgwks_viz_project",
        "lgwks_waste",
        "scripts.build_capability_idf"
      ],
      "Membrane / intent / steering": [
        "lgwks_concept",
        "lgwks_intent",
        "lgwks_intent_classifier",
        "lgwks_intent_router",
        "lgwks_machine",
        "lgwks_multiply",
        "lgwks_steering",
        "lgwks_vault",
        "tools.train_intent_classifier"
      ],
      "Models / runtime (opaque dep)": [
        "lgwks_apple",
        "lgwks_coreml",
        "lgwks_jepa",
        "lgwks_model_hub",
        "lgwks_multimodal",
        "lgwks_ollama",
        "lgwks_openrouter",
        "lgwks_openrouter_embed",
        "scripts.build_capability_embeddings"
      ],
      "Research / web acquisition / extract": [
        "lgwks_auth_runtime",
        "lgwks_browser",
        "lgwks_crawl",
        "lgwks_expression",
        "lgwks_files",
        "lgwks_geoexpr",
        "lgwks_html",
        "lgwks_ingest",
        "lgwks_preview",
        "lgwks_public",
        "lgwks_search",
        "lgwks_site_profile",
        "lgwks_sites",
        "lgwks_substrate_crawl"
      ],
      "Substrate / storage / schema": [
        "lgwks_batch",
        "lgwks_cache",
        "lgwks_capture",
        "lgwks_cognition",
        "lgwks_lfm2_extract",
        "lgwks_memory",
        "lgwks_project_artifacts",
        "lgwks_schema",
        "lgwks_sqlite",
        "lgwks_substrate",
        "lgwks_substrate_config",
        "lgwks_substrate_db",
        "lgwks_substrate_io",
        "lgwks_substrate_text",
        "lgwks_substrate_vector"
      ],
      "Unclassified (triage)": [
        "lgwks_access",
        "lgwks_research"
      ]
    }
  },
  "modules": {
    "axiom.__init__": {
      "deps": [],
      "has_cli": false,
      "has_tests": false,
      "integration": "integrated",
      "last_commit_days": 5,
      "loc": 20,
      "owning_issue": null,
      "packet": null,
      "purpose": "the standalone byte framework for the Axiom machine-first ISA.",
      "staleness": "active",
      "subsystem": "Axiom byte framework",
      "used_by": [
        "lgwks(dispatcher)",
        "lgwks_axiom",
        "lgwks_crdt",
        "lgwks_embed_port",
        "lgwks_home",
        "lgwks_intent_router",
        "lgwks_manifest",
        "lgwks_research",
        "lgwks_run",
        "lgwks_schema",
        "lgwks_vector",
        "scripts"
      ]
    },
    "axiom.capsule": {
      "deps": [],
      "has_cli": false,
      "has_tests": false,
      "integration": "integrated",
      "last_commit_days": 5,
      "loc": 171,
      "owning_issue": null,
      "packet": null,
      "purpose": "The Capsule \u2014 one typed, content-addressed record. Claim asserts; Hole abstains. The unit the verifier",
      "staleness": "active",
      "subsystem": "Axiom byte framework",
      "used_by": [
        "lgwks(dispatcher)",
        "lgwks_axiom",
        "lgwks_crdt",